title,lead,content,image,slug,published_date,impressions_count
12 Reasons why you should learn Ruby on Rails,Deciding what programming language to start with can be tedious and frustrating. Here are 12 reasons why Ruby on Rails is the right language for you!,"<p>“Learning to program is exciting: it's stimulating, fun, develops new ways of 

thinking, and in a very short time you can build programs that will impress 

your friends and family! Discovering the joy of programming was the spark that 

started my professional life and impressed the teenage beauty who, 40 years 

later, is still the love of my life!“ - John Hennessy President, Stanford University </p>

<p>It was only 7 months ago and I was completely new to this whole Tech Startups 

and ‘coding’ phenomenon. It was amazing the things you see in the media or on 

the internet with publications like TechCrunch or StartupSmart, where you hear 

about all these amazing Tech Startups getting funded or getting traction and 

even more amazingly, making social impact. </p>

<p>I originally came to the ‘coding’ world simply to learn some basic skills to help 

myself in my digital marketing prospects. Being a university student in such a 

tough job market, it always seems that an employer wants more than just your 

usual complementary skills to the job requirements – you have to have the ‘X 

factor’. </p>

<p>However, I never knew what language I should build cool stuff. Like, I knew that 

I should learn HTML, CSS and some JavaScript, but I never knew how to actual 

incorporate these skills when learning into building an actual tech startup. </p>

<p>Since then, not only have I nearly had one job offer each day for having skills to 

build Ruby on Rails applications, I’m still a complete beginner and I’ve built apps 

which are on <a href""http://www.heroku.com"" target=_blank"">Heroku</a>.</p> 

<p>How does a complete beginner with no clue what so ever, build apps and now 

even teaches the language and framework? Here are the 15 best reasons why 

you should learn Ruby on Rails:</p>

<p><strong>1. Beginner Friendly </p></strong>

<p>Ruby on Rails was amazing when I first started out less than a year ago. 

The ‘cleanliness’ of the structure of the code made it pretty easy for myself to 

pick up. It just started making sense and to see the ‘easy-to-read’ relationship 

between the front-end and back-end applications work in sync truly made it 

an enjoyable experience. It is an easy language for experienced programmers 

to quickly pick up and to pump out quick apps when they feel like it. Obviously 

fellow newbies, start with Ruby on Rails.</p>

<p><strong>2. Perfect for MVP </p></strong>

<p>I’m a big believer that if you want to build an amazing tech startup, not only 

should you gain customer validation, but gain customer validation through 

proof. Ruby on Rails is the perfect language and framework to build quick MVP 

prototypes to show roughly (or extensively if you pick it up) how your startup 

will operate. If you gain some users, perfect, you have done it quickly and very 

cheaply in a short period of time. Now, you will be able to find tech co-founders 

in no time.</p>

<p><strong>3. Keeping it Lean </p></strong>

<p>This also comes back to reason number 2. Learning Ruby on Rails is cheap. 

Whether you do <a href=""http://openeducationchallenge.eu/blog/why-all-tech-entrepreneurs-must-know-about-code"" target=""_blank"">online free courses</a> (although limited) or 

part time courses, or even a boot camp, learning Ruby is really based on time 

investment. No matter your experience level, you can build something cheap 

which is really cool for the world to see. </p>

<p><strong>4. Quick application </p></strong>

<p>When I first started using Ruby on Rails, I was amazed how quickly you can build 

an app. I remember in my first class, we built Facebook in just one day – all the 

functionality. It was amazing how cool it was to see something built so quickly 

for myself to built that.</p>

<p><strong>5. Developer Happiness </p></strong>

<p>Ruby is a dynamic, reflective, object-oriented, general-purpose programming 

language. It was designed and developed in the mid-1990s by Yukihiro ""Matz"" 

Matsumoto in Japan. It was originally built for ‘developer happiness’ and when 

you ask any developer you meet, they would know that Ruby on Rails is a great 

way to build apps (although opinions vary from developer to developer). From 

my experience, I just really enjoyed how easy it was to read and follow – I 

honestly though ‘code’ was just all 0’s and 1’s but Ruby on Rails has opened my 

eyes and brings out my creative side without much frustration. Now that is true 

happiness.</p>

<p><strong>6. Amazing Community </p></strong>

<p>The community for Ruby on Rails is amazing. There are countless of online free 

tutorials and help with major development questions and answer sites, such 

as <a href=""http://stackoverflow.com/"" target=""_blank"">Stack Overflow</a>, which will help you on your 

journey to building something great. If you want to begin your development 

career and build something great, head to Meetup groups. At The Coder Factory, 

we hold a Meetup called <a href=""http://www.meetup.com/Sunday-
Coder-Club/"" target=""_blank"">Sunday Coder Club</a> where all languages come together and learn code, but there are 

specific groups which are primarily just for Ruby enthusiasts and newbies. Don’t 

be afraid to go along, they are cool people. </p>

<p><strong>7. Open Source </p></strong>

<p>One of the best things about Ruby on Rails, with being completely new to 

building applications, is how much you can do without actually knowing that 

much at all. Not only is it free of charge, it’s also free to use, copy, modify, and 

distribute.</p>

<p><strong>8. Bring ideas into life </p></strong>

<p>Again, this does come back to reason number 2, but what is so awesome about 

Ruby on Rails is that you can bring your ideas to fruition very quickly and inspire 

others to do the same. You can make any app idea you want.</p> 

<p><strong>9. Understand more about technology</p></strong>
<p>I believe coding is creative. It’s the new creative arts in my opinion – particularly 

in the 21st

and we don’t know how they are built – and for most, no one has a clue. Ruby on 

Rails will get you thinking outside of the square. In my experience, and I know 

plenty of others, it has opened up my understanding of the digital world. What 

 Century. Everyone can draw a painting, yet we use apps everyday 

was once a mystery now seems so clear. It’s actually a really cool bragging right 

to have to understand technology, people think you are ‘smart’ – but you don’t 

have to b<e!</p>

<p><strong>10. Innovative thinking </p></strong>

<p>This sounds familiar to what I just said, but learning Ruby on Rails will give you 

an amazing scope of how things work in the world and in business – particularly 

in technology businesses. Whether you’re in business or everyday life in work, 

we are always sending strategists, creatives and some team management people. 

If you have a better understanding of technology, two things will happen: 

o Have more innovative ideas about processes, systems and improve 

efficiency through technology

o And you also treat your internal and external partners in a considerably 

more effective manner.</p>

<p><strong>11. It will create better job opportunities </p></strong> 

<p>Not to long ago I posted a blog about <a href=""https://thecoderfactory.com/posts/top-15-sites-built-with-ruby-on-rails"" target=""_blank"">Top 15 sites built with Ruby on Rails </a>

 and 

talked about cool jobs you can get, like working for Bloomberg (which was built 

with Ruby). There is a high demand for Ruby developers out there and some are 

willing to take people who have only just started their journey not long after. If 

you’re bored of your job, learn Ruby on Rails. </p>

<p><strong>12. Produce complex websites easily </p></strong>

<p>The greatest way of building a personal brand is having your own site. What 

better way instead of paying someone hundreds to thousands of dollars building 

your site, or even alternatives on the web, build your own awesome website. 

You can do anything with it and it doesn’t take long to build a website with Ruby. 

Even better yet, Ruby on Rails produces and provides an amazing experience 

where you can incorporate both front-end and back-end functionality quick and 

easy. Use Bootstrap! Bootstrap makes front-end web development faster and 

easier. It's made for folks of all skill levels, devices of all shapes, and projects of 

all sizes. You can easily sync it into your code fast and effectively and can build 

the most amazing User interfaces.</p>",http://res.cloudinary.com/coder-factory/image/upload/v1401845572/e220chcuhaelv1mn9b0x.png,Why-Ruby-on-Rails-Right-Programming-Language,2014-05-22,0
Interview with Chris Withers,In this weeks talk we got Chris Withers to speak about his experience in our Brisbane Beginner Class and where he wants to take his new found skills to.,"<p><strong>Hi Chris, thanks for taking the time! Could you tell us a bit about you? </strong></p>

<p>Not a problem. I&rsquo;m an Economics/Law student at the University of Queensland, with a keen interest in tech start ups and entrepreneurship generally.</p>

<p><strong>You took our Brisbane Weekend Beginner class. Why did you decide to learn coding?</strong></p>

<p>Technology is undoubtedly the way of the future, and coding will be its language. After watching the presentation Coding Factory at Ignite, I was inspired to learn and felt that this program would be a great start.</p>

<p><strong>We believe that learning to code not only teaches you web development, but also thinking outside the box and crucial problem solving skills. Did you take any of this from the course?</strong></p>

<p>Coding is not for everyone. Fortunately, after grasping the basics I was able to understand the rational patterns that form code and visualise how it all fitted together. Even if you don&rsquo;t pursue it further, the course definitely gives you an appreciation for looking beyond the norm when it comes to solving problems.</p>

<p><strong>What use do you want to put your new skills to?</strong></p>

<p>Entrepreneurship. Never before has the barrier to entry been so low in terms of an emerging market and if you don&rsquo;t hop on board now, I fear you could miss the train. I paired up with a few software engineers and formed a start-up, and amhoping to put this code to furthering our projects.</p>

<p><strong>What part of programming do you consider the most compelling?</strong></p>

<p>Compelling is an interesting choice of word. Naturally, the heavy lifting is all back end, and it is something I can really appreciate despite having little knowledge of. That said, at the end of the day, often it&rsquo;s the front end design work that sells the product. I&rsquo;m definitely more of a front end kind of guy.</p>

<p><strong>Are you going to keep developing your coding skills? </strong></p>

<p>Most definitely. Already a few days after the course I was scouring GitHub for tutorials to increase the functionality of the web app I had created. The course really inspired me and got me passionate about coding and the endless possibilities.</p>

<p><strong>If you had the ability to build anything you ever dreamed of, what would it be?</strong></p>

<p>A place where people, enthusiastic about their passions, especially related to startups could connect and canvas their ideas &ndash; without worrying about harsh criticism or the possibility of having their concept stolen. Without new ideas, new frames of mind and new shifts in paradigm, the world wouldn&rsquo;t be what it is today.</p>

<p><strong>Thanks a lot for you time, Chris!</strong></p>
",http://res.cloudinary.com/coder-factory/image/upload/v1402062112/tlqsxmwuvtvik6ltvjit.png,Interview-Beginner-Coding-Chris-Withers,2014-05-21,3
Interview with Kim Heras,"In this weeks talk we are happy to have Kim Heras of 25fifteen telling us his views about startups, accelerating and coding","<p style=""text-align: justify;""><strong>Hi Kim, thanks for taking the time! Could you tell us a bit about yourself?</strong></p>

<p style=""text-align: justify;"">I&#39;m a Founding Partner at Startup Studio, 25Fifteen, and co-founder of renowned startup community organisation, PushStart. Also, I&#39;m a Director of Fishburners, Australia&rsquo;s leading tech startup co-working space.</p>

<p style=""text-align: justify;"">I have worked in the Australian tech startup community for over 10 years: As an entrepreneur, as the former editor of The Next Web, Australia and as an event organiser. I&#39;m the founder of the Sydney Tech Startup Meetup &ndash; Australia&rsquo;s longest running and largest tech startup meetup with over 3400 members &ndash; and the Sydney FinTech Startup Meetup.</p>

<p style=""text-align: justify;""><strong>Please tell us a bit more about the investment focus and strategy of 25fifteen?</strong></p>

<p style=""text-align: justify;"">We believe that startups are a craft - there are things you can do to improve your chances of success, learnable things, subject to the scientific method.</p>

<p style=""text-align: justify;"">We&#39;re a group of successful entrepreneurs and industry veterans who use our execution experience, capital, and relationships to help startups reach a profitable exit.</p>

<p style=""text-align: justify;"">We invest in and co-found startups. We focus on companies aiming for early and realistic exits, rather than the moonshots most venture investors look for.</p>

<p style=""text-align: justify;"">&nbsp;</p>

<p style=""text-align: justify;"">We work closely with potential exit partners, so that we know what these companies are looking for, and can involve them in our companies early in the life cycle.</p>

<p style=""text-align: justify;""><strong>When looking at new investment opportunities, what part do coding skills of the team members play in your decision?</strong></p>

<p style=""text-align: justify;"">Certainly a bonus to have but not critical.</p>

<p style=""text-align: justify;""><strong>Would a start up that has a first technical prototype have better chances for an investment with you than a start up without?</strong></p>

<p style=""text-align: justify;"">It&rsquo;s not a dealbreaker if there&rsquo;s no technical prototype but having one would probably help to a) show that you&rsquo;re a do-er b) help explain how you think the product will work c) hopefully give you some data (from usage of that prototype) on how people will use it.</p>

<p style=""text-align: justify;""><strong>Many people claim that the Australian tech scene is still underdeveloped compared to Europe and the U.S. What would you say the Australian start-up ecosystem does well and where do we need to catch up?</strong></p>

<p style=""text-align: justify;"">&nbsp;</p>

<p style=""text-align: justify;"">We do everything well. We just need to do more of it.</p>

<p style=""text-align: justify;""><strong>What is your general view on coding? Do you think it is an essential skill that should be taught to kids at an early age?</strong></p>

<p style=""text-align: justify;"">&nbsp;</p>

<p style=""text-align: justify;"">Tech skills are a key component of any technology company. I think if we want to have a future where technology innovation is a key component of the Australian economy then we need to be training our kids as early as possible</p>

<p style=""text-align: justify;""><strong>What would be the key piece of advice you would you give to all aspiring entrepreneurs?</strong></p>

<p style=""text-align: justify;"">&nbsp;</p>

<p style=""text-align: justify;"">Start. Today.</p>

<p style=""text-align: justify;""><strong>Thanks for your time Kim!</strong></p>

<p>&nbsp;</p>
",http://res.cloudinary.com/coder-factory/image/upload/v1401848000/nqd69lsbg5nmdbhzi1f0.png,Kim-Heras-Interview-Coding,2014-05-09,3
What I Love About Teaching People to Code,"I am a Ruby on Rails, web application development instructor and I love what I do. Teaching people to create apps with great tools and well designed platforms is a joy for me.","<h2 style=""text-align:justify"">What I teach</h2>

<p style=""text-align:justify"">I&rsquo;ve always enjoyed teaching. Even in my days at IBM, I held technical workshops and end-user training for fellow employees, business partners and our customers. It is a great feeling to be able to share my knowledge with people, especially when it helps them in their work or lives.</p>

<p style=""text-align:justify"">Conducting training on software packages is one thing, but teaching coding is another kettle of fish altogether. Especially since teaching someone how to build their own apps, enables them to make a living for themselves, whether that&rsquo;s creating a tech startup company, or starting a new career in the IT industry.</p>

<p style=""text-align:justify"">Ruby on Rails is a great language and platform to teach people. It&rsquo;s easy for beginners to learn and it allows the students to quickly build things without having to be a computer scientist and understand everything about computers.</p>

<p style=""text-align:justify"">Of course it&rsquo;s great to teach the concepts of application and database design, software patterns and object oriented theory. But it&rsquo;s the practical building of apps using such a great framework that gives so much joy to all.</p>

<h2 style=""text-align:justify"">The way I teach</h2>

<p style=""text-align:justify"">I&rsquo;m a self taught Rails coder and I think that has helped me a better Rails teacher. I learnt so many things the hard way, fumbling through tutorials and documentation, that I&rsquo;m able to see the platform through a beginner&rsquo;s eyes.</p>

<p style=""text-align:justify"">I also realise the importance of the student having a project they want to build. An app idea they are passionate about. This provides so much extra motivation for the student to persevere and get themselves over those inevitable hurdles.</p>

<p style=""text-align:justify"">The projects I provide for my students are applications that are familiar to them. That way the concepts make more sense as the students can relate to the functionality and application design.</p>

<p style=""text-align:justify"">Despite having taught myself Rails with tutorials I found in books and online, I have never enjoyed learning on my own, away from a classroom. Having a teacher explain concepts in their own words, drawing on a white board, relating the concepts to real world examples, has always been my preferred method of learning.</p>

<p style=""text-align:justify"">It&rsquo;s also the presence of other students, going through the same experience as myself, facing the same challenges. I find myself thinking, &quot;if that student can learn and understand this, so can I&quot;.</p>

<p style=""text-align:justify"">So I&rsquo;m proud to teach in a classroom, providing a great experience for my students. Giving them opportunities to meet new friends and possible business partners. I love finding great ways to explain difficult concepts.</p>

<h2 style=""text-align:justify"">The students I teach</h2>

<p style=""text-align:justify"">It is great to see people from all different backgrounds being drawn to coding. I am a believer that technology can solve so many of the world&rsquo;s challenges and that teaching more people to code might help us solve some problems sooner rather than later.</p>

<p style=""text-align:justify"">My students are fitness trainers, stock brokers, cafe waiters, graphic designers. They&rsquo;re still at university or in their 50&rsquo;s, working 9-5 or unemployed. Some of them have played with HTML, others have created a game or two, but most have never programmed before in their life.</p>

<p style=""text-align:justify"">It&rsquo;s amazing to see my students find enjoyment in coding, especially when they were afraid they wouldn&rsquo;t be able to learn it. It gives me a buzz when I hear a student say &ldquo;Wow!&rdquo; as they refresh their browser and see the results of their coding.</p>

<p style=""text-align:justify"">My favourite part is when the Rails concepts and power begins to make sense to the students. I see their eyes go wide and their smile become a grin as they realise the possibilities they now have in front of them. Now they can build anything they want. Their lives will never be the same.</p>

<p style=""text-align:justify"">It goes without saying that it&rsquo;s a thrill to see Coder Factory graduates go on to work in web development agencies and be accepted into incubators. It&rsquo;s the most rewarding feeling I&rsquo;ve had in my life.</p>

<h2 style=""text-align:justify"">The love of teaching coding</h2>

<p style=""text-align:justify"">As you can tell, I love what I do for a living. It takes energy to put on a great class every day - but it isn&rsquo;t work for me. I&rsquo;m not afraid to say that I&rsquo;m not yet the best teacher I can be, because I&rsquo;m still getting better every class that I run. I&rsquo;m always finding better ways to explain concepts, more interesting projects for the students to build, easier tools to help build their dreams.</p>

<p style=""text-align:justify"">If you think you might enjoy being a coding instructor, give it a shot. Even if you aren&rsquo;t a coder now, go out there, find a class to attend and begin your journey to a rewarding career.</p>
",http://res.cloudinary.com/coder-factory/image/upload/v1402072379/atr65xvxpib1tsb9dhv3.png,why-i-love-teaching-coding,2014-03-10,3
