title,lead,content,image,slug,published_date,impressions_count
12 Reasons why you should learn Ruby on Rails,Deciding what programming language to start with can be tedious and frustrating. Here are 12 reasons why Ruby on Rails is the right language for you!,"<p>“Learning to program is exciting: it's stimulating, fun, develops new ways of 

thinking, and in a very short time you can build programs that will impress 

your friends and family! Discovering the joy of programming was the spark that 

started my professional life and impressed the teenage beauty who, 40 years 

later, is still the love of my life!“ - John Hennessy President, Stanford University </p>

<p>It was only 7 months ago and I was completely new to this whole Tech Startups 

and ‘coding’ phenomenon. It was amazing the things you see in the media or on 

the internet with publications like TechCrunch or StartupSmart, where you hear 

about all these amazing Tech Startups getting funded or getting traction and 

even more amazingly, making social impact. </p>

<p>I originally came to the ‘coding’ world simply to learn some basic skills to help 

myself in my digital marketing prospects. Being a university student in such a 

tough job market, it always seems that an employer wants more than just your 

usual complementary skills to the job requirements – you have to have the ‘X 

factor’. </p>

<p>However, I never knew what language I should build cool stuff. Like, I knew that 

I should learn HTML, CSS and some JavaScript, but I never knew how to actual 

incorporate these skills when learning into building an actual tech startup. </p>

<p>Since then, not only have I nearly had one job offer each day for having skills to 

build Ruby on Rails applications, I’m still a complete beginner and I’ve built apps 

which are on <a href""http://www.heroku.com"" target=_blank"">Heroku</a>.</p> 

<p>How does a complete beginner with no clue what so ever, build apps and now 

even teaches the language and framework? Here are the 15 best reasons why 

you should learn Ruby on Rails:</p>

<p><strong>1. Beginner Friendly </p></strong>

<p>Ruby on Rails was amazing when I first started out less than a year ago. 

The ‘cleanliness’ of the structure of the code made it pretty easy for myself to 

pick up. It just started making sense and to see the ‘easy-to-read’ relationship 

between the front-end and back-end applications work in sync truly made it 

an enjoyable experience. It is an easy language for experienced programmers 

to quickly pick up and to pump out quick apps when they feel like it. Obviously 

fellow newbies, start with Ruby on Rails.</p>

<p><strong>2. Perfect for MVP </p></strong>

<p>I’m a big believer that if you want to build an amazing tech startup, not only 

should you gain customer validation, but gain customer validation through 

proof. Ruby on Rails is the perfect language and framework to build quick MVP 

prototypes to show roughly (or extensively if you pick it up) how your startup 

will operate. If you gain some users, perfect, you have done it quickly and very 

cheaply in a short period of time. Now, you will be able to find tech co-founders 

in no time.</p>

<p><strong>3. Keeping it Lean </p></strong>

<p>This also comes back to reason number 2. Learning Ruby on Rails is cheap. 

Whether you do <a href=""http://openeducationchallenge.eu/blog/why-all-tech-entrepreneurs-must-know-about-code"" target=""_blank"">online free courses</a> (although limited) or 

part time courses, or even a boot camp, learning Ruby is really based on time 

investment. No matter your experience level, you can build something cheap 

which is really cool for the world to see. </p>

<p><strong>4. Quick application </p></strong>

<p>When I first started using Ruby on Rails, I was amazed how quickly you can build 

an app. I remember in my first class, we built Facebook in just one day – all the 

functionality. It was amazing how cool it was to see something built so quickly 

for myself to built that.</p>

<p><strong>5. Developer Happiness </p></strong>

<p>Ruby is a dynamic, reflective, object-oriented, general-purpose programming 

language. It was designed and developed in the mid-1990s by Yukihiro ""Matz"" 

Matsumoto in Japan. It was originally built for ‘developer happiness’ and when 

you ask any developer you meet, they would know that Ruby on Rails is a great 

way to build apps (although opinions vary from developer to developer). From 

my experience, I just really enjoyed how easy it was to read and follow – I 

honestly though ‘code’ was just all 0’s and 1’s but Ruby on Rails has opened my 

eyes and brings out my creative side without much frustration. Now that is true 

happiness.</p>

<p><strong>6. Amazing Community </p></strong>

<p>The community for Ruby on Rails is amazing. There are countless of online free 

tutorials and help with major development questions and answer sites, such 

as <a href=""http://stackoverflow.com/"" target=""_blank"">Stack Overflow</a>, which will help you on your 

journey to building something great. If you want to begin your development 

career and build something great, head to Meetup groups. At The Coder Factory, 

we hold a Meetup called <a href=""http://www.meetup.com/Sunday-
Coder-Club/"" target=""_blank"">Sunday Coder Club</a> where all languages come together and learn code, but there are 

specific groups which are primarily just for Ruby enthusiasts and newbies. Don’t 

be afraid to go along, they are cool people. </p>

<p><strong>7. Open Source </p></strong>

<p>One of the best things about Ruby on Rails, with being completely new to 

building applications, is how much you can do without actually knowing that 

much at all. Not only is it free of charge, it’s also free to use, copy, modify, and 

distribute.</p>

<p><strong>8. Bring ideas into life </p></strong>

<p>Again, this does come back to reason number 2, but what is so awesome about 

Ruby on Rails is that you can bring your ideas to fruition very quickly and inspire 

others to do the same. You can make any app idea you want.</p> 

<p><strong>9. Understand more about technology</p></strong>
<p>I believe coding is creative. It’s the new creative arts in my opinion – particularly 

in the 21st

and we don’t know how they are built – and for most, no one has a clue. Ruby on 

Rails will get you thinking outside of the square. In my experience, and I know 

plenty of others, it has opened up my understanding of the digital world. What 

 Century. Everyone can draw a painting, yet we use apps everyday 

was once a mystery now seems so clear. It’s actually a really cool bragging right 

to have to understand technology, people think you are ‘smart’ – but you don’t 

have to b<e!</p>

<p><strong>10. Innovative thinking </p></strong>

<p>This sounds familiar to what I just said, but learning Ruby on Rails will give you 

an amazing scope of how things work in the world and in business – particularly 

in technology businesses. Whether you’re in business or everyday life in work, 

we are always sending strategists, creatives and some team management people. 

If you have a better understanding of technology, two things will happen: 

o Have more innovative ideas about processes, systems and improve 

efficiency through technology

o And you also treat your internal and external partners in a considerably 

more effective manner.</p>

<p><strong>11. It will create better job opportunities </p></strong> 

<p>Not to long ago I posted a blog about <a href=""https://thecoderfactory.com/posts/top-15-sites-built-with-ruby-on-rails"" target=""_blank"">Top 15 sites built with Ruby on Rails </a>

 and 

talked about cool jobs you can get, like working for Bloomberg (which was built 

with Ruby). There is a high demand for Ruby developers out there and some are 

willing to take people who have only just started their journey not long after. If 

you’re bored of your job, learn Ruby on Rails. </p>

<p><strong>12. Produce complex websites easily </p></strong>

<p>The greatest way of building a personal brand is having your own site. What 

better way instead of paying someone hundreds to thousands of dollars building 

your site, or even alternatives on the web, build your own awesome website. 

You can do anything with it and it doesn’t take long to build a website with Ruby. 

Even better yet, Ruby on Rails produces and provides an amazing experience 

where you can incorporate both front-end and back-end functionality quick and 

easy. Use Bootstrap! Bootstrap makes front-end web development faster and 

easier. It's made for folks of all skill levels, devices of all shapes, and projects of 

all sizes. You can easily sync it into your code fast and effectively and can build 

the most amazing User interfaces.</p>",http://res.cloudinary.com/coder-factory/image/upload/v1401845527/yhnkttuwzchvuhsunxv1.png,Why-Ruby-on-Rails-Right-Programming-Language,2014-06-04,7
Why Australia must embrace the digital age,While countries like the U.S. and China are investing heavily into the digital future Australia could be lagging behind if we don't take immediate action.,"<p style=""text-align:justify"">Dice, a US IT employment site, recently announced a historical dip of unemployment in the technology sector from 3.5% in Q1 2013 to 2.7% in Q1 2014. Anecdotes about poaching within the industry are all too common, especially between goliaths like Google, Facebook, Twitter, Yahoo and Amazon. What does the local scene look like? Whilst it is developing, it&rsquo;s a far cry from thriving tech hubs like Silicon Valley, Berlin, Tel Aviv or New York. Is coding a skill that will benefit Australia&rsquo;s economy and social fabric? Is the internet economy even worth the attention when Australia is able to live comfortably off its resources in the short term?</p>


<h4 style=""text-align:justify"">What are the numbers?</h4>

<p style=""text-align:justify"">91% of Australia&rsquo;s population was using the internet as at January 2014. On a per capita basis <a href=""http://www.swinburne.edu.au/media-centre/news/2013/12/online-economy-continues-to-bloom-world-internet-project-finds.html"" target=""_blank"">Australians were spending $2,616 p.a. online </a>(this only includes online shopping and thus excludes services). <a href=""http://www.deloitte.com/view/en_AU/au/news-research/media-releases/2182c69146c81310VgnVCM2000001b56f00aRCRD.htm"" target=""_blank"">Deloitte</a> found that the whole industry was worth $50 Billion in 2010 which is almost the size of the whole retail industry and bigger than Australia&rsquo;s annual iron ore exports. In total there were 190,000 people employed in the internet sector and complementary industries, which represents ~ 1.7% of Australia&rsquo;s workforce.</p>



<p style=""text-align:justify"">The recent PwC <a href=""http://www.digitalpulse.pwc.com.au/australian-tech-startup-ecosystem/"" target=""_blank"">Startup Economy report </a> suggests that high growth technology companies could account for 1) 4% of the GDP which equals $109 Billion (compared to approximately 0.2% today) and 2) 540.000 jobs by 2033.</p>



<p style=""text-align:justify"">Internationally the number of internet users is expected to reach 3 Billion and the combined net worth of the G-20 digital economies will equal US $4.2 Trillion, according to a study conducted by <a href=""https://www.bcgperspectives.com/content/articles/media_entertainment_strategic_planning_4_2_trillion_opportunity_internet_economy_g20/"" target=""_blank"">Boston Consulting Group</a>.</p>


<h4 style=""text-align:justify"">Don&rsquo;t be passive, create something!</h4>



<p style=""text-align:justify"">There is no question that the internet is playing a huge role in nearly every aspect of our lives. It&rsquo;s a place where we search for and buy products and services, where we connect with friends and work colleagues; it&rsquo;s a source of media content, and even a place of productivity.</p>


<p style=""text-align:justify"">In fact the BCG report found, that 77% of the Americans asked would rather give up chocolate than going without the internet for a year. But while there are many people out there who have seen the opportunity technology presents to us, most of us remain passive consumers of those services. There continues to be a myth that technology is difficult, which is not the case. There are many accounts out of kids creating valuable apps. For example there is the inspiring <a href=""http://www.huffingtonpost.com/2011/01/26/robert-nay-bubble-ball-14-year-old-built-iphone-app_n_910170.html"" target=""_blank"">story</a> of 14 year old Robert Nay who created a game called Bubble Ball, dethroning Angry Birds in January 2011 from its number one spot on the iTunes App Store. Or the story of <a href=""http://www.businessinsider.com.au/homeless-coder-2013-9#ixzz2g1h3LeUK"" target=""_blank"">Leo</a>, a homeless guy from New York who learned coding through the generosity of a developer who passed him on his daily commute and who has succeeded in creating his own app in just eight weeks.</p>

<h4 style=""text-align:justify"">How can we capitalize on this opportunity?</h4>



<p style=""text-align:justify"">Australians need to develop the skills of the future to harness the opportunities the digital age presents. <a href=""http://docs.employment.gov.au/system/files/doc/other/ictprofessions.pdf"" target=""_blank"">Official statements </a> suggest that there is no shortage of skilled IT professionals including web developers on the Australian market. This stands in stark contrast to what industry insiders say. Matt Barrie, CEO of freelancer.com states in the <a href=""http://www.afr.com/p/technology/freelancer_com_chief_blasts_government_V57V8DrUL2eaztlF6Wbw0O"" target=""_blank"">Australian Financial Review</a> that it is incredibly hard to find qualified staff for modern technology companies, while government bodies still look at basic technician and administrator roles when talking about ICT professions. The recent Startupaus.org <a href=""http://startupaus.org/wp-content/uploads/2014/04/startupaus_infographic_final.pdf"" target=""_blank"">Crossroads report</a> states that only 2% of Australian university graduates acquired ICT skills while the demand doubled and only 2% of 2 million Australian kids have been exposed to entrepreneurial skills. In fact tech companies have to go and look for applicants overseas with developer programmers being the fourth most nominated occupation for temporary visa applications in 2012-13. Australians need to acquire coding skills to prevent our digital economy from falling behind.</p>



<h4 style=""text-align:justify"">How is The Coder Factory involved in solving this problem?</h4>

<p style=""text-align:justify"">Since September 2013 we have taught over fifty students to be more confident with their coding skills in classes ranging from beginner to expert . A big success story for The Coder Factory has been Mark Collins, one of our first students, was accepted into both <a href=""http://incubate.org.au"" target=""_blank"">Incubate</a> and Telstra&#39;s <a href=""http://muru-d.com"" target=""_blank""> Muru-D</a> after completing his Rails coding course. Mark has built <a href=""http://www.vistr.com.au/"" target=""_blank"">Vistr</a> an online financial tool that lets small businesses improve their cashflow to form better forecasting. The Coder Factory also has 4 students working at Black Citrus.</p>


<p style=""text-align:justify"">Through Coder Club we have assembled volunteers to teach coding skills at 5 schools all around Sydney, these classes will be delivered weekly over the next school term. The objective of this initiative is to 1) highlight coding is fun 2) inspire future use of technology 3) enable kids to create something tangible and rewarding using technology. As we grow a key strategic pillar of ours is to deliver many more classes all around Australia to help spark an interest in technology.</p>
",http://res.cloudinary.com/coder-factory/image/upload/v1401849831/hhvc0qjz12pk9wazzxl0.png,why-australia-must-embrace-digital-age,2014-04-29,3
Everything you need to know about Heartbleed,Even after three weeks we are still being contacted by people about the Heartbleed bug. This is why we decided to create this comprehensive article that will leave no question unanswered.,"<h4 style=""text-align: justify;"">A story of heartbeats</h4>

<p style=""text-align: justify;"">About three weeks ago a major flaw in the open source SSL software created a hitherto unknown outcry not only in tech savvy but also in mainstream media. But what exactly is Heartbleed apart from being the first bug with a beautiful logo? The Coder Factory tells you everything you need to know about Heartbleed and what actions you should take.</p>

<h4 style=""text-align: justify;"">What happened?</h4>

<p style=""text-align: justify;"">On March 21st Neel Mehta of Google Security discovered the vulnerability in the SSL certificate. Google then created a patch to fix the problem and applied it progressively to its services. On April the 1st the Open SSL team was notified and a patch was then applied to fix the software which in its latest version 1.0.1g. is immune for attacks trying to exploit the bug. On April the 7th most of the world found out about Heartbleed which by that time got a pretty little website run by the Finish IT security firm Codenomicon that discovered the bug separately to Mehta on April the 2nd. What followed was an intensive coverage of Heartbleed in almost every publication.</p>

<h4 style=""text-align: justify;"">What is Heartbleed?</h4>

<p style=""text-align: justify;"">Heartbleed is a tiny little bug in the OpenSSL TLS (Transport Layer Security) &lsquo;heartbeat&rsquo; mechanism. TLS is a protocol that is used to secure communication between web services, by exchanging a symmetric key. The logic behind this is pretty much similar to your Bluetooth encryption. Only if you insert a specified key, your devices will connect (attention: oversimplification!!). The Heartbeat mechanism is nothing more than a periodic signal that ensures the key is valid. The bug in this mechanism is a missing bounds check that can be used to fetch data from a server. In normal use the heartbeat request sends a message with a payload, typically a text string along with the payloads length. The receiving server must then send the exact same payload back to ensure encryption. The missing bounds check allows attackers to extend the length of the request, permitting them to receive a much longer response containing the text string but also whatever 496 characters (in case of a 4 character string) happened to be in the server memory before. That could be completely useless data but it could also contain master keys, passwords, and usernames which then could be used to attain further data such as credit card information.</p>

<p style=""text-align: justify;""><img class=""img-thumbnail"" src=""http://s30.postimg.org/y6b2dv26p/both.png"" /></p>

<p style=""text-align: justify;"">All this wouldn&rsquo;t be worth discussing if this was an isolated bug that only appeared on your mums online shop for handmade socks. But the adoption of OpenSSL is estimated to be two thirds of the servers currently on the internet. Among the affected websites were Eventbrite, OKCupid and even the website of the FBI. The online magazine Ars Technica points out that OpenSSL is &ldquo;by far the Internet&rsquo;s most popular open-source cryptographic library and TLS implementation&rdquo;.</p>

<h4 style=""text-align: justify;"">What can I do?</h4>

<p style=""text-align: justify;"">First of all change your passwords! No one knows on which scale the bug has been exploited so changing your passwords is a necessary precaution all of us should take. There are various tools out there that are supposed to detect if the site is affected one of them being AppCheck by Codenomicon. If you are an administrator or webmaster you should already have applied the patch. Reissue your SSL certificates and urge users to change their passwords!</p>
",http://res.cloudinary.com/coder-factory/image/upload/v1401849445/xa5snre7kkptspocxoxe.png,Everything-Need-Know-About-Heartbleed,2014-05-01,2
